audio	sentence
/home/skscla001/experiments/hf/speech/data/BembaSpeech/bem/audio/03-200924-200908_bem_798_elicit_20.wav	nga cakuti umuntu atetekela yesu kristu ukupitila mu kupilibukila kuli lesa no kuba umwana wakwe alapokelela mupashi wa mushilo ukufuma kuli lesa
/home/skscla001/experiments/hf/speech/data/BembaSpeech/bem/audio/03-200920-120041_bem_798_elicit_1.wav	ubulwele bwa kolonavailasi twenty nineteen covidnineteen buulwele ubufulunganya imipemene ubuletwa na kashiishi akapya aka kolona
/home/skscla001/experiments/hf/speech/data/BembaSpeech/bem/audio/09-200916-054405_bem_a40_elicit_7.wav	tulefwaya ukukula cimo mu mushi
/home/skscla001/experiments/hf/speech/data/BembaSpeech/bem/audio/03-201006-021353_bem_798_elicit_10.wav	kabili ngolafwayo kuti ukamuupe takwaba cacila pa kumwafwa ngalecula mu nshila ii ukumutalalikako mutima
/home/skscla001/experiments/hf/speech/data/BembaSpeech/bem/audio/03-200921-160552_bem_798_elicit_5.wav	ba kapokola mu calo ca australia bantu abasuma kabili abacetekelwa
/home/skscla001/experiments/hf/speech/data/BembaSpeech/bem/audio/03-201007-011712_bem_798_elicit_35.wav	shamitombo balishibene nao nokutemwana nganshi eco kali akasekela ukumwafwako mu nshila ishilifye shonse
/home/skscla001/experiments/hf/speech/data/BembaSpeech/bem/audio/03-200925-003120_bem_798_elicit_33.wav	nga cakutila ifwe nga bafyashi nangu fwe ntungulushi tatucitilepo nangu cimo
/home/skscla001/experiments/hf/speech/data/BembaSpeech/bem/audio/03-201004-091537_bem_798_elicit_22.wav	inkondo bailwile nshiku shine abawe nabo bakosele cibi
/home/skscla001/experiments/hf/speech/data/BembaSpeech/bem/audio/03-201006-013752_bem_798_elicit_44.wav	shamitombo camupelenganya nganshi cumi
/home/skscla001/experiments/hf/speech/data/BembaSpeech/bem/audio/03-200925-043821_bem_798_elicit_11.wav	ishina lyabo ni ba katato sensele
/home/skscla001/experiments/hf/speech/data/BembaSpeech/bem/audio/03-201004-113233_bem_798_elicit_24.wav	ico bashalepyanikila bakalalamba kwena ni mukuu bakaimwene ifyo umwana akalakula
/home/skscla001/experiments/hf/speech/data/BembaSpeech/bem/audio/03-200921-105818_bem_798_elicit_4.wav	tamufwile ukwikata mu menso mu moona na mu kanwa ukwabula ukusamba ku minwe
/home/skscla001/experiments/hf/speech/data/BembaSpeech/bem/audio/03-201007-015856_bem_798_elicit_53.wav	amwenefye uko umukashi wakwe awa no mulopa walipo na cululululululu
/home/skscla001/experiments/hf/speech/data/BembaSpeech/bem/audio/03-201004-122608_bem_798_elicit_31.wav	uyo onse ushaletula nama shingi ninshi ashama
/home/skscla001/experiments/hf/speech/data/BembaSpeech/bem/audio/04-200914-215547_bem_346_elicit_15.wav	ishina lyandi ni niza'
/home/skscla001/experiments/hf/speech/data/BembaSpeech/bem/audio/03-200924-204525_bem_798_elicit_49.wav	nga kuti twaishiba shani ifya kukabila fyabo nga tatukwete isenge nabo
/home/skscla001/experiments/hf/speech/data/BembaSpeech/bem/audio/03-200921-160552_bem_798_elicit_20.wav	amafunde mu calo ca australia tayakwata akapatulula pakati ka banakashi na baume
/home/skscla001/experiments/hf/speech/data/BembaSpeech/bem/audio/03-201004-103454_bem_798_elicit_42.wav	bapunshishe bushiku bonse kuti pakuti buce balasako imfubu shisano ne n wena nasho shibili
/home/skscla001/experiments/hf/speech/data/BembaSpeech/bem/audio/03-200925-010537_bem_798_elicit_21.wav	ena nga twaisa kuli ena alisosa ukutila uleisa kuli ena takamutamfye iyoo
/home/skscla001/experiments/hf/speech/data/BembaSpeech/bem/audio/03-200916-120506_bem_798_elicit_28.wav	inshiku sha mulungu mu cibemba
/home/skscla001/experiments/hf/speech/data/BembaSpeech/bem/audio/03-201007-013831_bem_798_elicit_47.wav	yasuka ne mitima yauma
/home/skscla001/experiments/hf/speech/data/BembaSpeech/bem/audio/03-200925-003120_bem_798_elicit_49.wav	abo ebongola abantu no kubatwa mu cilubo ku mano yabo aya bucenjeshi
/home/skscla001/experiments/hf/speech/data/BembaSpeech/bem/audio/03-200925-062606_bem_798_elicit_15.wav	shilingile shibalilapo kwipusha bakalemba ba natuleya
/home/skscla001/experiments/hf/speech/data/BembaSpeech/bem/audio/04-201005-212105_bem_40e_elicit_14.wav	kanshi kamupepe alenjiswila
/home/skscla001/experiments/hf/speech/data/BembaSpeech/bem/audio/03-200916-010158_bem_798_elicit_17.wav	eico mulifyonse ifyo umufyashi acita alafwaya ukuba icilangililo ku bana
/home/skscla001/experiments/hf/speech/data/BembaSpeech/bem/audio/04-200916-232841_bem_346_elicit_10.wav	mpelako kamo steward
/home/skscla001/experiments/hf/speech/data/BembaSpeech/bem/audio/03-200925-062606_bem_798_elicit_17.wav	pamulandu wa fintu ifilecitika pakati kesu
/home/skscla001/experiments/hf/speech/data/BembaSpeech/bem/audio/03-201007-002328_bem_798_elicit_26.wav	aingila na mukau buce buce aletina ukucite congo ico aishibe ukuti pali ba mangala amakumi yatatu na pabula
/home/skscla001/experiments/hf/speech/data/BembaSpeech/bem/audio/03-201004-110412_bem_798_elicit_17.wav	bamobamo fye cbalesokako abanabo abati kwena nelyo line tulefwayo kwipaya aba bantu lacilingile ukuti twipaye uyu muntu wakashike nkanda
/home/skscla001/experiments/hf/speech/data/BembaSpeech/bem/audio/03-200925-050356_bem_798_elicit_47.wav	bushe ulupwa lwenu lwaciloseshe mwisa pakumona ukuti mwaitumpa mu kushimpa icilonganino
/home/skscla001/experiments/hf/speech/data/BembaSpeech/bem/audio/03-201006-011410_bem_798_elicit_29.wav	ico shamitombo taleumfwako ifyo balesosa asekafye babwela balafunkana na mu minwe
/home/skscla001/experiments/hf/speech/data/BembaSpeech/bem/audio/03-200924-200908_bem_798_elicit_12.wav	bushe epapelela amatontonkanyo yobe ayakuba kacimfya mu bulwi bwakukana ulubembu na wishi waluko kasebanya
/home/skscla001/experiments/hf/speech/data/BembaSpeech/bem/audio/04-200917-142312_bem_346_elicit_29.wav	talefwaya nokulaya ku sukulu
/home/skscla001/experiments/hf/speech/data/BembaSpeech/bem/audio/03-201007-002328_bem_798_elicit_1.wav	muka wongo baima na koyikoyi bakungushanya balaya ku cuulu
/home/skscla001/experiments/hf/speech/data/BembaSpeech/bem/audio/04-200914-215547_bem_346_elicit_46.wav	ehe bakalailandapo
/home/skscla001/experiments/hf/speech/data/BembaSpeech/bem/audio/03-200923-215451_bem_798_elicit_21.wav	landeni nankwe pafyo mwasangamo elyo landeni na lesa palwa uyo mulimo
/home/skscla001/experiments/hf/speech/data/BembaSpeech/bem/audio/03-201007-015856_bem_798_elicit_26.wav	pantu lingi umbi bali no kuodafye
/home/skscla001/experiments/hf/speech/data/BembaSpeech/bem/audio/03-200923-215451_bem_798_elicit_45.wav	lelo namisango yakulaba nenuna
/home/skscla001/experiments/hf/speech/data/BembaSpeech/bem/audio/03-200923-215451_bem_798_elicit_15.wav	te kupitila mu fyo twasuminamo nangu mu fikulwa fyesu nangu mu fyatantikwa lelo ukupitila mu citemwiko cesu emo twishibikilwa
/home/skscla001/experiments/hf/speech/data/BembaSpeech/bem/audio/04-200916-232841_bem_346_elicit_19.wav	elo nomba apa alecita bwino namunsamushi
/home/skscla001/experiments/hf/speech/data/BembaSpeech/bem/audio/03-200921-114142_bem_798_elicit_19.wav	ukubomfiwa mukulungana no muntu
/home/skscla001/experiments/hf/speech/data/BembaSpeech/bem/audio/03-201002-091908_bem_798_elicit_10.wav	bushe kapumpe aupillwe kuli ani  kuli kasaaka uwafumine ku mpanda
/home/skscla001/experiments/hf/speech/data/BembaSpeech/bem/audio/03-200925-003120_bem_798_elicit_30.wav	muleisunga bwino mulesunga no mukuni onse mupashi wamushilo amupeela ukwangalila
/home/skscla001/experiments/hf/speech/data/BembaSpeech/bem/audio/03-200921-105818_bem_798_elicit_41.wav	umutwe ubukali
/home/skscla001/experiments/hf/speech/data/BembaSpeech/bem/audio/04-200916-223805_bem_346_elicit_2.wav	bamunina bakwe nibanani
/home/skscla001/experiments/hf/speech/data/BembaSpeech/bem/audio/03-200916-023738_bem_798_elicit_27.wav	cacine ulubuli mute
/home/skscla001/experiments/hf/speech/data/BembaSpeech/bem/audio/09-200916-054405_bem_a40_elicit_35.wav	natotela sana pakuncikulako pali fyonse ifi
/home/skscla001/experiments/hf/speech/data/BembaSpeech/bem/audio/04-200916-232135_bem_346_elicit_20.wav	kanshi ngawakumanya umuntu naumbi kwati umunobe filya
/home/skscla001/experiments/hf/speech/data/BembaSpeech/bem/audio/03-201006-003654_bem_798_elicit_11.wav	nakabili cili ku caalo nga cayamusekesha
/home/skscla001/experiments/hf/speech/data/BembaSpeech/bem/audio/04-200917-201407_bem_346_elicit_5.wav	nomba ngatawishibe ishina lyabo kwipusha
/home/skscla001/experiments/hf/speech/data/BembaSpeech/bem/audio/03-200925-062606_bem_798_elicit_11.wav	kanshi emulandu twalundamo akapepela aka
/home/skscla001/experiments/hf/speech/data/BembaSpeech/bem/audio/03-200918-110406_bem_798_elicit_12.wav	pakuti bekwata amafi tubatotele tusunge bwino ifyo balekula
/home/skscla001/experiments/hf/speech/data/BembaSpeech/bem/audio/03-200918-110406_bem_798_elicit_22.wav	nseba ishendela pamo
/home/skscla001/experiments/hf/speech/data/BembaSpeech/bem/audio/03-200925-053533_bem_798_elicit_40.wav	tukolwe utushatetekele mu ng'wena
/home/skscla001/experiments/hf/speech/data/BembaSpeech/bem/audio/03-200924-181036_bem_798_elicit_24.wav	abantu abengi balatemwa ukukokola mukulanda pamo no kupekanya inshila yakucimfishamo amafya  elyo balekapofye
/home/skscla001/experiments/hf/speech/data/BembaSpeech/bem/audio/04-201012-174116_bmy_47d_elicit_11.wav	baleshimika no kuti uyu munyinabo shimapepo alicila ne ngulu yaliko muli shilya nshiku makumba
/home/skscla001/experiments/hf/speech/data/BembaSpeech/bem/audio/04-201009-110829_bem_40e_elicit_6.wav	umfweni mwandini mwe bana ine nali umwaice ilyo shikofu motomoto aishile na banankwe
/home/skscla001/experiments/hf/speech/data/BembaSpeech/bem/audio/04-201005-205341_bem_40e_elicit_26.wav	kanshi mulenga wa mpanga alumbukila ku milimo umwine abombele iya bukapepa
/home/skscla001/experiments/hf/speech/data/BembaSpeech/bem/audio/07-200916-164857_bem_c20_elicit_11.wav	elyo akati cisuma mune ntulako icipute ici untulefye kukanwa umubili ine walisashilia
/home/skscla001/experiments/hf/speech/data/BembaSpeech/bem/audio/04-201008-155010_bem_40e_elicit_8.wav	pamo pene ngo muntu umo mu lupwa iwabo nga afwa asha umo uwa mu lupwa ali ne fumo
/home/skscla001/experiments/hf/speech/data/BembaSpeech/bem/audio/03-201004-113233_bem_798_elicit_19.wav	e mukuti cine cine imipashi naimusekelela aili munensu naese twikale nankwe
/home/skscla001/experiments/hf/speech/data/BembaSpeech/bem/audio/04-200916-232135_bem_346_elicit_4.wav	mwatusheni mukwai
/home/skscla001/experiments/hf/speech/data/BembaSpeech/bem/audio/03-201001-105646_bem_798_elicit_41.wav	kwaleba ukumwa ifikoti nolucu lumbi ulwashala
/home/skscla001/experiments/hf/speech/data/BembaSpeech/bem/audio/03-201006-015824_bem_798_elicit_15.wav	ka viloto kena kali mu cikini emo kalele utulo
/home/skscla001/experiments/hf/speech/data/BembaSpeech/bem/audio/04-201008-153522_bem_40e_elicit_18.wav	kanshi takwaba icintu ico bapela ishina icishabako
/home/skscla001/experiments/hf/speech/data/BembaSpeech/bem/audio/03-201006-021353_bem_798_elicit_44.wav	ebele ine ndi mukaya saana na ba mangala
/home/skscla001/experiments/hf/speech/data/BembaSpeech/bem/audio/03-200925-050356_bem_798_elicit_31.wav	lelo ni panuma yakupita inshita ninshi ne cilonganino nacimikwa elyo twasambilishiwe amasambililo ya bukatanda
/home/skscla001/experiments/hf/speech/data/BembaSpeech/bem/audio/04-201005-205341_bem_40e_elicit_10.wav	limolimo uyu nyinabo katayi aleitilwa na kuli mwenya kwine baleti namwenya
/home/skscla001/experiments/hf/speech/data/BembaSpeech/bem/audio/03-200921-171929_bem_798_elicit_8.wav	ukwikatilila ku ndalama
/home/skscla001/experiments/hf/speech/data/BembaSpeech/bem/audio/03-200916-010158_bem_798_elicit_14.wav	cimumbwa pala noko pala wiso ukuwama
/home/skscla001/experiments/hf/speech/data/BembaSpeech/bem/audio/03-200925-003120_bem_798_elicit_32.wav	napali imwe bene pakema bamo abakalalanda ifya bufi pakuti bongole abasambi abakulabakonka
/home/skscla001/experiments/hf/speech/data/BembaSpeech/bem/audio/03-201004-091537_bem_798_elicit_46.wav	kuti nga bakulasa kamo teti umone na pakulukuntila
/home/skscla001/experiments/hf/speech/data/BembaSpeech/bem/audio/03-201003-235942_bem_798_elicit_7.wav	kuti cilyo musungu ati alasemofye mfuti ala mukwai apalakashamofye yati no kuti wapaapa kalama
/home/skscla001/experiments/hf/speech/data/BembaSpeech/bem/audio/03-200925-061220_bem_798_elicit_36.wav	insansa ishingi ishingaba kuli imwe babili kwisamba kulya
/home/skscla001/experiments/hf/speech/data/BembaSpeech/bem/audio/03-201004-103454_bem_798_elicit_36.wav	banwe basekelele mipashi yabo
/home/skscla001/experiments/hf/speech/data/BembaSpeech/bem/audio/04-201009-110017_bem_40e_elicit_31.wav	mulambi aima baya na ulya mwaushi ashelepo apepapo awe cayanduluka
/home/skscla001/experiments/hf/speech/data/BembaSpeech/bem/audio/03-200923-215451_bem_798_elicit_33.wav	lelo aba pelishiti balilolele nganshi batompwe bakwa shauli na bantu bakwe bacucutike nga pali kapashi
/home/skscla001/experiments/hf/speech/data/BembaSpeech/bem/audio/03-200925-043821_bem_798_elicit_49.wav	ici cifulo cabafye pa ncende iinono na bantu abengi balafwaya ukufumako
/home/skscla001/experiments/hf/speech/data/BembaSpeech/bem/audio/03-200925-061220_bem_798_elicit_41.wav	bushe umucila batile wamaka ukucila umulembe wa nsofu
/home/skscla001/experiments/hf/speech/data/BembaSpeech/bem/audio/03-200921-112400_bem_798_elicit_18.wav	takuli umuntu nangu umo uulingile ukusuminisha ukumucusha nangu ukumucena
/home/skscla001/experiments/hf/speech/data/BembaSpeech/bem/audio/03-200924-214522_bem_798_elicit_33.wav	icishinka cakuti mwaliba abena kristu cipilibula ukuti mufwile ukuba mwisenge na batetekela bambi
/home/skscla001/experiments/hf/speech/data/BembaSpeech/bem/audio/04-201009-110829_bem_40e_elicit_12.wav	kanshi umuntu nga alifwa abwela mu calo alecusha abantu mwishibe ukuti umubili alecushishako abantu ashime kuli shikulu wakwe ciwa
/home/skscla001/experiments/hf/speech/data/BembaSpeech/bem/audio/04-200916-232135_bem_346_elicit_11.wav	kanofye ngaba ati 'imakaneni' elo nabena baiminina
/home/skscla001/experiments/hf/speech/data/BembaSpeech/bem/audio/04-201009-122744_bem_40e_elicit_21.wav	ili lyena imibengelele ya liko e fipolopolo fya mfuti
/home/skscla001/experiments/hf/speech/data/BembaSpeech/bem/audio/03-200921-114142_bem_798_elicit_14.wav	ukubyala ifimiti
/home/skscla001/experiments/hf/speech/data/BembaSpeech/bem/audio/03-201002-054811_bem_798_elicit_7.wav	twamipaapata ukuti mwise nenondo yamupashi nokwisa tobaula ifyabubi fyonse ifyo tucita
/home/skscla001/experiments/hf/speech/data/BembaSpeech/bem/audio/03-200916-125910_bem_798_elicit_29.wav	niwe mwine pacuulu abantu bonse panshi
/home/skscla001/experiments/hf/speech/data/BembaSpeech/bem/audio/04-200917-142312_bem_346_elicit_31.wav	elo alifye ne myaka sikisi
/home/skscla001/experiments/hf/speech/data/BembaSpeech/bem/audio/03-200921-105818_bem_798_elicit_40.wav	ukupemashika
/home/skscla001/experiments/hf/speech/data/BembaSpeech/bem/audio/03-200923-215451_bem_798_elicit_6.wav	ena eco aishibe cakuti nincingililwa icipanga candi cilencingilila
/home/skscla001/experiments/hf/speech/data/BembaSpeech/bem/audio/03-200923-215451_bem_798_elicit_23.wav	bushe kuti wacita shani nga cakuti abakalamba ba ncito yobe balefwaya ulecita ubucenjeshi
/home/skscla001/experiments/hf/speech/data/BembaSpeech/bem/audio/03-200925-061220_bem_798_elicit_8.wav	akumenye ng'wena elyo
/home/skscla001/experiments/hf/speech/data/BembaSpeech/bem/audio/03-200925-053533_bem_798_elicit_26.wav	pa cabumo kuti twatemwa ukumono kuti tatulebomba na ncitatubi uyo ulefwaya ukubutuka ukusalapulwa ku lukuta afumine
/home/skscla001/experiments/hf/speech/data/BembaSpeech/bem/audio/04-200916-232135_bem_346_elicit_12.wav	abengi abana abesa kuno ba soli
/home/skscla001/experiments/hf/speech/data/BembaSpeech/bem/audio/04-201005-212919_bem_40e_elicit_6.wav	uyu mukote ishina lyakwe ni shamungole
/home/skscla001/experiments/hf/speech/data/BembaSpeech/bem/audio/03-201007-011712_bem_798_elicit_14.wav	elyo alundapo no kutila icuma cinecine cintu akanonka mukashi kumfwa maria nga asumina ukuti akamuupe
/home/skscla001/experiments/hf/speech/data/BembaSpeech/bem/audio/03-200925-050356_bem_798_elicit_35.wav	bushe mwalikwete abalemwafwilisha ukufuma muno zambia nangu kunse ya calo
/home/skscla001/experiments/hf/speech/data/BembaSpeech/bem/audio/03-200921-214144_bem_798_elicit_2.wav	ukusembululwa nangu ukuputulwa kwa banakashi kuputula kumufulo nangu ukwalula kwa fyamfwalo ifya banakashi apabula umulandu nangu umo uukumine ku bumi
/home/skscla001/experiments/hf/speech/data/BembaSpeech/bem/audio/03-200925-003120_bem_798_elicit_26.wav	tatufwile twaba abakuposa inshita iyitali mukubebeta mu cipingo kabili no kulanshanya pali uyu mulandu
/home/skscla001/experiments/hf/speech/data/BembaSpeech/bem/audio/03-200920-120041_bem_798_elicit_22.wav	umuntu onse kuti ayambula ubu bulwele lelo cintu cayanguka saana ku bantu bamo pamo nga aba ukwambula ubulwele
/home/skscla001/experiments/hf/speech/data/BembaSpeech/bem/audio/03-201001-105646_bem_798_elicit_10.wav	ilyo twikele shikulu alanda pali cimwangalala uo baleyangala bonse kubwaice
/home/skscla001/experiments/hf/speech/data/BembaSpeech/bem/audio/03-200916-010158_bem_798_elicit_41.wav	mumutima wakwe mubilima umulilo wakuyamona ifyo abafyashi baleemweba
/home/skscla001/experiments/hf/speech/data/BembaSpeech/bem/audio/07-200916-171635_bem_c20_elicit_1.wav	awe imfumu yakaka yapeela na umulumendo aiti efyo ukaya mukukangasha
/home/skscla001/experiments/hf/speech/data/BembaSpeech/bem/audio/04-200917-143010_bem_346_elicit_18.wav	ncili ndefwaya pensulo
/home/skscla001/experiments/hf/speech/data/BembaSpeech/bem/audio/09-200916-054405_bem_a40_elicit_8.wav	ico cawama pakabela kusala incende iilingile
/home/skscla001/experiments/hf/speech/data/BembaSpeech/bem/audio/03-201006-025003_bem_798_elicit_48.wav	koyikoyi eka ewalelansha muka wongo
/home/skscla001/experiments/hf/speech/data/BembaSpeech/bem/audio/03-201007-013831_bem_798_elicit_21.wav	ahbudula ashumfwafye ishiwi um wenso wamwikata
/home/skscla001/experiments/hf/speech/data/BembaSpeech/bem/audio/03-201007-002328_bem_798_elicit_45.wav	shamitombo ninshi nabalangapo apo babike mfuui ne mbokoshi sha fipolopolo fine
/home/skscla001/experiments/hf/speech/data/BembaSpeech/bem/audio/03-201002-093346_bem_798_elicit_5.wav	lumbula imbuto imisango ine isho basenda mupanga nga balecindila nacisungu
/home/skscla001/experiments/hf/speech/data/BembaSpeech/bem/audio/03-200920-120041_bem_798_elicit_30.wav	pa mulandu wakuti ubulwele bwa kolona buulwele ubukali nganshi elyo nefyo bulesalanganina ku ncende shimbi
/home/skscla001/experiments/hf/speech/data/BembaSpeech/bem/audio/03-201004-103454_bem_798_elicit_25.wav	pa kumuposamo baleti kafwe uli paki lya mipashi yesu
/home/skscla001/experiments/hf/speech/data/BembaSpeech/bem/audio/03-200923-230549_bem_798_elicit_39.wav	ulingile ukulaba pamo nga dabidi tekwesha ukupalana na galyati
/home/skscla001/experiments/hf/speech/data/BembaSpeech/bem/audio/04-201012-174116_bmy_47d_elicit_2.wav	na nomba amanika ya mimana ingi mu lubemba mukasanga yaba ne mputa sha kale
/home/skscla001/experiments/hf/speech/data/BembaSpeech/bem/audio/03-201006-011410_bem_798_elicit_7.wav	baukula mwisamba lya lupili ulo batila blueville iwabo lwafita ekwafuma ne shina line ilyo
/home/skscla001/experiments/hf/speech/data/BembaSpeech/bem/audio/03-200924-194133_bem_798_elicit_27.wav	nga cakuti uleya mukulanshanya ulingile ukutontonkanya pa mabwe yasano ayengakwafwa
/home/skscla001/experiments/hf/speech/data/BembaSpeech/bem/audio/03-201007-004908_bem_798_elicit_40.wav	maria pa kumfwa amashiwi ya musango uyu camupeseshe na maano
/home/skscla001/experiments/hf/speech/data/BembaSpeech/bem/audio/03-201003-235942_bem_798_elicit_4.wav	batile bashima baendele amapanga ayengi saana ukwabula ukusange nsofu
/home/skscla001/experiments/hf/speech/data/BembaSpeech/bem/audio/03-200925-062606_bem_798_elicit_21.wav	kuti cawama ukwishibisha babwamanyina bambi ukupitila muli ici citabo epali nalimo bamo balefwaya ukulanshanya nabo
/home/skscla001/experiments/hf/speech/data/BembaSpeech/bem/audio/04-200917-202808_bem_346_elicit_16.wav	cinshi calubana cinshi ulelilila
/home/skscla001/experiments/hf/speech/data/BembaSpeech/bem/audio/03-200925-010537_bem_798_elicit_8.wav	imisepela shesu shali linga ukubikako amaka yesu
/home/skscla001/experiments/hf/speech/data/BembaSpeech/bem/audio/03-201004-103454_bem_798_elicit_26.wav	umuntu kutifye na mingilile mu lucengo na fitandabube fyamukunga fyamufyenta na mu masumbu yafiko
/home/skscla001/experiments/hf/speech/data/BembaSpeech/bem/audio/04-200916-232620_bem_346_elicit_21.wav	pakanwa
/home/skscla001/experiments/hf/speech/data/BembaSpeech/bem/audio/04-200917-142312_bem_346_elicit_36.wav	namwishiba afwile aishiba ukulanda bwino icisungu pantu emutundu wasuminishiwa
/home/skscla001/experiments/hf/speech/data/BembaSpeech/bem/audio/03-201002-093346_bem_798_elicit_6.wav	amasaka imbalala intoyo cilemba sonkwenaamankolobwe
/home/skscla001/experiments/hf/speech/data/BembaSpeech/bem/audio/03-200921-154823_bem_798_elicit_26.wav	nangula icitupa cimbi icakwenekela icupo elyo mwasangwa mu lyashi lya mutitikisha wa mpango
/home/skscla001/experiments/hf/speech/data/BembaSpeech/bem/audio/03-201006-021353_bem_798_elicit_29.wav	abula na campa umo uwakale eo asenda e bupe bwa kutwalila wongo
/home/skscla001/experiments/hf/speech/data/BembaSpeech/bem/audio/03-200916-120506_bem_798_elicit_12.wav	iyi ine nshita elyo kuba nokutomona ifyakulya ifyapala imyungu ifipushi ifibimbi inyanje nafimbipo
/home/skscla001/experiments/hf/speech/data/BembaSpeech/bem/audio/03-201007-011712_bem_798_elicit_11.wav	nangu umutima ushamuloseshe pa kuilumbilisha ukuti nao ni mfumu
/home/skscla001/experiments/hf/speech/data/BembaSpeech/bem/audio/03-200916-125910_bem_798_elicit_23.wav	niwe catile uwaponokela limo
/home/skscla001/experiments/hf/speech/data/BembaSpeech/bem/audio/03-200921-162447_bem_798_elicit_21.wav	elyona ukutiinya abaice nangu ifiteekwa
/home/skscla001/experiments/hf/speech/data/BembaSpeech/bem/audio/03-200923-230549_bem_798_elicit_16.wav	nomba dabidi aleya no kubwela ukufuma kuli shauli no kuya kukucema umukuni wakwa wishi ku betelehemu
/home/skscla001/experiments/hf/speech/data/BembaSpeech/bem/audio/03-201004-110412_bem_798_elicit_43.wav	umusungu wena ifyakutontonkanya fyafulilako
/home/skscla001/experiments/hf/speech/data/BembaSpeech/bem/audio/04-200914-215055_bem_346_elicit_12.wav	walalya pa kwinuka
/home/skscla001/experiments/hf/speech/data/BembaSpeech/bem/audio/03-201002-091908_bem_798_elicit_33.wav	amaso yalamena pacinena
/home/skscla001/experiments/hf/speech/data/BembaSpeech/bem/audio/04-201009-110017_bem_40e_elicit_4.wav	pakubala natumfwe bwino uyu mulandu we tandwe
/home/skscla001/experiments/hf/speech/data/BembaSpeech/bem/audio/03-201002-054811_bem_798_elicit_50.wav	umwaume umbi alifililwe isukulu alateya injuka
/home/skscla001/experiments/hf/speech/data/BembaSpeech/bem/audio/03-200916-010158_bem_798_elicit_38.wav	umufyashi musuma nangu alifuma kwabo ukutali mumafunde yakwe alabaka mukweba umwana ishina lya mushi wabo ifikolwe fyabo
/home/skscla001/experiments/hf/speech/data/BembaSpeech/bem/audio/03-201007-015856_bem_798_elicit_60.wav	nako ka viloto bwangu bwangukufika ninshi apo balelwila ukutole mfuti yakwa shamitombo apo yaponene
/home/skscla001/experiments/hf/speech/data/BembaSpeech/bem/audio/03-201007-022920_bem_798_elicit_40.wav	abantu bakwa shamitombo bonse abo bam upeele na bantu bakwa patili ferdinand bonse bakuki na bakufunda katikishimu
/home/skscla001/experiments/hf/speech/data/BembaSpeech/bem/audio/03-200915-234914_bem_798_elicit_30.wav	amapinda yantu yatushiila ifikolwe
/home/skscla001/experiments/hf/speech/data/BembaSpeech/bem/audio/03-201002-091908_bem_798_elicit_8.wav	nshatalile andala no mwanakashi
/home/skscla001/experiments/hf/speech/data/BembaSpeech/bem/audio/03-201007-002328_bem_798_elicit_47.wav	abantu kabapasangane laata
/home/skscla001/experiments/hf/speech/data/BembaSpeech/bem/audio/03-200916-010158_bem_798_elicit_8.wav	kanshi katutotele kuli lesa mukulu uwabapeele abafyashi abo ababapeele amafunde yasuma ukufuma fye ulo baali abaice
/home/skscla001/experiments/hf/speech/data/BembaSpeech/bem/audio/03-200925-003120_bem_798_elicit_54.wav	ifwe pamo nga bafyashi nangu intungulushi tulingile ukuba pamo na bana besu pakutila twingabafwilisha
/home/skscla001/experiments/hf/speech/data/BembaSpeech/bem/audio/03-200920-120041_bem_798_elicit_34.wav	tamufwile ukwikata mu menso mu moona na mu kanwa ukwabula ukusamba ku minwe
/home/skscla001/experiments/hf/speech/data/BembaSpeech/bem/audio/03-201007-013831_bem_798_elicit_43.wav	bena kulya kuti cabasekeshe nganshi abati mwandi elyo tukwete cita icakuti na pa kutusha caikata ifipondo ukunoku
/home/skscla001/experiments/hf/speech/data/BembaSpeech/bem/audio/03-201006-025003_bem_798_elicit_19.wav	kanshi uyo mako nabamupikile ni ba mashetu bene
/home/skscla001/experiments/hf/speech/data/BembaSpeech/bem/audio/03-200925-062606_bem_798_elicit_52.wav	kasalanganya akalatuma indalama ishikalafuma kuli bakashitisha bakwe kuli coordinator wa ico citungu elyo coordinator nao akalatuma ku kasama
/home/skscla001/experiments/hf/speech/data/BembaSpeech/bem/audio/03-200918-110406_bem_798_elicit_9.wav	icipuba ecisundila no kunyelela mucishima kinwamo amenshi
/home/skscla001/experiments/hf/speech/data/BembaSpeech/bem/audio/04-201008-155438_bem_40e_elicit_2.wav	balepisha fye umunwe pa mukoshi basonta na mu mulu abati lesa ku mulu
/home/skscla001/experiments/hf/speech/data/BembaSpeech/bem/audio/03-200924-214522_bem_798_elicit_30.wav	ilingi abantu baibimba mu fintu pantu kuli ifyo balekonkelela
/home/skscla001/experiments/hf/speech/data/BembaSpeech/bem/audio/03-201004-110412_bem_798_elicit_10.wav	lyena pa kuya ku kushika kano babale bayetula ku mipashi yabo
/home/skscla001/experiments/hf/speech/data/BembaSpeech/bem/audio/03-200918-110406_bem_798_elicit_48.wav	nabana bakakula ilyo bakasoma ici citabo tabakalabe ifyo bamobamo pa bantu babo bacitile ku mwabo
