audio	sentence
/home/skscla001/experiments/hf/speech/data/BembaSpeech/bem/audio/03-200921-114142_bem_798_elicit_0.wav	ukushitisha kwa bantu elyo no kusunga mu busha
/home/skscla001/experiments/hf/speech/data/BembaSpeech/bem/audio/03-201007-004908_bem_798_elicit_12.wav	amulekelefye aya
/home/skscla001/experiments/hf/speech/data/BembaSpeech/bem/audio/03-200916-010158_bem_798_elicit_44.wav	bantu baishiba balupwa lwabo
/home/skscla001/experiments/hf/speech/data/BembaSpeech/bem/audio/03-201006-011410_bem_798_elicit_26.wav	asuka anatole uwamutolele alamulondolola ku banankwe abasungu na bafita
/home/skscla001/experiments/hf/speech/data/BembaSpeech/bem/audio/03-201007-002328_bem_798_elicit_31.wav	acitilefye mfofa imo na pa lucembe e mifwile
/home/skscla001/experiments/hf/speech/data/BembaSpeech/bem/audio/03-201002-085315_bem_798_elicit_10.wav	teacher edwin uwapa roan school
/home/skscla001/experiments/hf/speech/data/BembaSpeech/bem/audio/03-200920-120041_bem_798_elicit_43.wav	bushe kwaliba umuti wa kundapa ubulwele bwa kolonavailasi twenty nineteen
/home/skscla001/experiments/hf/speech/data/BembaSpeech/bem/audio/03-200916-040939_bem_798_elicit_40.wav	ifyobalaile ngatabaficitile fikasasa
/home/skscla001/experiments/hf/speech/data/BembaSpeech/bem/audio/03-201006-021353_bem_798_elicit_11.wav	shamitombo ilyo line ebele nangu cikabe shani ba mangala bapya
/home/skscla001/experiments/hf/speech/data/BembaSpeech/bem/audio/03-200925-070127_bem_798_elicit_5.wav	nalimo abantu bambi kuti bafwaya ukukabushanya bushe kuti nacita shani
/home/skscla001/experiments/hf/speech/data/BembaSpeech/bem/audio/03-200916-040939_bem_798_elicit_30.wav	eico abafyashi bonse balasambilisha abana ukutabepa bufi
/home/skscla001/experiments/hf/speech/data/BembaSpeech/bem/audio/03-200925-003120_bem_798_elicit_16.wav	lutampulo nshi twalasenda pamo nge ntungulushi
/home/skscla001/experiments/hf/speech/data/BembaSpeech/bem/audio/03-201007-015856_bem_798_elicit_61.wav	koyikoyi ukuboko kumo kuli pa mukoshi wakwa shamitombo kumbi nako kulepepesha napali mfuli
/home/skscla001/experiments/hf/speech/data/BembaSpeech/bem/audio/03-201002-054811_bem_798_elicit_51.wav	tsotsi nakapenta basungu baleta
/home/skscla001/experiments/hf/speech/data/BembaSpeech/bem/audio/04-200917-143010_bem_346_elicit_21.wav	ba kafundisha ngatabaliko kuti twaendafye nokwingila
/home/skscla001/experiments/hf/speech/data/BembaSpeech/bem/audio/03-201006-013752_bem_798_elicit_47.wav	aishiba ati nomba elyo insa yafika six hours
/home/skscla001/experiments/hf/speech/data/BembaSpeech/bem/audio/03-201006-013752_bem_798_elicit_39.wav	kuti ukufika ku yanda ali nkonkonshe pa mwinshi aumfwafye muli tondolo
/home/skscla001/experiments/hf/speech/data/BembaSpeech/bem/audio/03-201002-054811_bem_798_elicit_42.wav	kumushi takwaba pension
/home/skscla001/experiments/hf/speech/data/BembaSpeech/bem/audio/03-201004-091537_bem_798_elicit_24.wav	muhenda ico e ntungulushi yabo ena bamupcele umukashana kashimoyo umwana wa mfumu mutombo wine
/home/skscla001/experiments/hf/speech/data/BembaSpeech/bem/audio/07-200916-162122_bem_c20_elicit_38.wav	elyo umulumendo umo aisamukobekela
/home/skscla001/experiments/hf/speech/data/BembaSpeech/bem/audio/03-200916-120506_bem_798_elicit_18.wav	ulusuba ninshita ya cipuki nakasuba akakaba
/home/skscla001/experiments/hf/speech/data/BembaSpeech/bem/audio/03-200921-114142_bem_798_elicit_39.wav	mukupelako ubwafwilisho ku bantu abashitishiwa nokusungwa mu busha
/home/skscla001/experiments/hf/speech/data/BembaSpeech/bem/audio/07-200916-162122_bem_c20_elicit_15.wav	ese atambe utomba
/home/skscla001/experiments/hf/speech/data/BembaSpeech/bem/audio/03-201007-004908_bem_798_elicit_14.wav	inshiku shakonkelepo apo baikatile ba mangala shamitombo alipokele ka lifi akanoono akamilungu ibili
/home/skscla001/experiments/hf/speech/data/BembaSpeech/bem/audio/03-200916-040939_bem_798_elicit_3.wav	naifwe ba sempya twilalaba ukubwelela limolimo ku mwesu
/home/skscla001/experiments/hf/speech/data/BembaSpeech/bem/audio/03-201002-085315_bem_798_elicit_31.wav	naani watile pio na vera tabafwile kupana
/home/skscla001/experiments/hf/speech/data/BembaSpeech/bem/audio/03-201006-011410_bem_798_elicit_18.wav	aikalile lwa ku mwinshi uko alemonafye na fyonse ifyalecitika
/home/skscla001/experiments/hf/speech/data/BembaSpeech/bem/audio/03-200925-043821_bem_798_elicit_46.wav	bushe milimo nshi mwalebomba pa tazara imyaka yonse
/home/skscla001/experiments/hf/speech/data/BembaSpeech/bem/audio/04-200916-232620_bem_346_elicit_7.wav	moneni efyo alaisa imba
/home/skscla001/experiments/hf/speech/data/BembaSpeech/bem/audio/03-200921-154823_bem_798_elicit_12.wav	ba kapokola mu calo ca australia bantu abasuma kabili abacetekelwa
/home/skscla001/experiments/hf/speech/data/BembaSpeech/bem/audio/03-200921-143443_bem_798_elicit_33.wav	ba mpandamano bakomfwa kuli fintu mulelanda ukwasuka amepusho yenu elyo nokumituma kumbi uko mwingasanga ubwafwilisho mu ncende yenu
/home/skscla001/experiments/hf/speech/data/BembaSpeech/bem/audio/03-201006-013752_bem_798_elicit_22.wav	epa kwasukafye at iyoo mukwai lelo kwena kuti naeshaeshako kwipusha
/home/skscla001/experiments/hf/speech/data/BembaSpeech/bem/audio/03-200921-114142_bem_798_elicit_51.wav	nangu pe buula lyapa intaneti ilyaba australian federal police pa wwwafpgovau
/home/skscla001/experiments/hf/speech/data/BembaSpeech/bem/audio/04-201005-211232_bem_40e_elicit_14.wav	abantu bonse e pa kwishiba ukuti mulenga ni shimapepo winewine
/home/skscla001/experiments/hf/speech/data/BembaSpeech/bem/audio/03-200921-154823_bem_798_elicit_33.wav	elyo nokusangwa mwibumba ilyabaleufya icupo cakupatikishiwa ngacakuti teiwe cikumine
/home/skscla001/experiments/hf/speech/data/BembaSpeech/bem/audio/03-201001-100406_bem_798_elicit_48.wav	balandile napakukaana tana umuntu icilyo
/home/skscla001/experiments/hf/speech/data/BembaSpeech/bem/audio/03-200925-003120_bem_798_elicit_57.wav	abati palwa scientology napapata te kwesha ukubasuminisha
/home/skscla001/experiments/hf/speech/data/BembaSpeech/bem/audio/03-200921-160552_bem_798_elicit_14.wav	ukutana umunobe nangu lupwa indalama shakubomfya
/home/skscla001/experiments/hf/speech/data/BembaSpeech/bem/audio/03-200921-112400_bem_798_elicit_1.wav	mu calo ca australia mulandu ukupatikisha umuntu nangu ukumucena pakupanga icupo
/home/skscla001/experiments/hf/speech/data/BembaSpeech/bem/audio/07-200916-171635_bem_c20_elicit_28.wav	awe ulumendo uyu aipaya na imfumu
/home/skscla001/experiments/hf/speech/data/BembaSpeech/bem/audio/03-200924-194133_bem_798_elicit_19.wav	nga cakuti tapali fisolobelo tulingile ukubomfya ifintu lesa atupeela pamo nga bapwapwa na mashiwi ayasuma
/home/skscla001/experiments/hf/speech/data/BembaSpeech/bem/audio/03-200918-110406_bem_798_elicit_15.wav	ba wesu twilaba ukuti akasembe kekete wiso bakatasho kutwa
/home/skscla001/experiments/hf/speech/data/BembaSpeech/bem/audio/04-200917-202142_bem_346_elicit_19.wav	ingileni ba geledi wanu b
/home/skscla001/experiments/hf/speech/data/BembaSpeech/bem/audio/04-200914-220511_bem_346_elicit_14.wav	bebeko waile kwisa
/home/skscla001/experiments/hf/speech/data/BembaSpeech/bem/audio/04-201005-212105_bem_40e_elicit_23.wav	kanshi ilyo bamwiswilile no mutima waika ainika no lupili lwine ishina lyakuti ni chishamutima
/home/skscla001/experiments/hf/speech/data/BembaSpeech/bem/audio/04-201008-154234_bem_40e_elicit_7.wav	kasonde na mwamba babukila fye mu kupunda kwakwa chilufya
/home/skscla001/experiments/hf/speech/data/BembaSpeech/bem/audio/04-201008-151412_bem_40e_elicit_3.wav	mpelako na ine amaka ya kwikatisho lukasu pakuti ndelimisha
/home/skscla001/experiments/hf/speech/data/BembaSpeech/bem/audio/03-201006-013752_bem_798_elicit_43.wav	ukulolekesha amona no munwe ulya bafwalako lingi nabauputula
/home/skscla001/experiments/hf/speech/data/BembaSpeech/bem/audio/03-201002-054811_bem_798_elicit_10.wav	peeleni icikuuku necongwe kuli bankosa mitima
/home/skscla001/experiments/hf/speech/data/BembaSpeech/bem/audio/03-201007-011712_bem_798_elicit_34.wav	abula ka viloto akakakila utupapa tonse tuntu aishile nafwala akapeela akalondolwela na bwinobwino inshila ya ku mwabo nako tekakani iyoo
/home/skscla001/experiments/hf/speech/data/BembaSpeech/bem/audio/03-200925-050356_bem_798_elicit_33.wav	kabili kuti nalanda ukuti mu myaka yakubalilapo
/home/skscla001/experiments/hf/speech/data/BembaSpeech/bem/audio/03-201006-011410_bem_798_elicit_44.wav	nomba cilingile ukuu nga bayakwingisha na iwe ukabikepo umutima pakusambilia lcipotugishi
/home/skscla001/experiments/hf/speech/data/BembaSpeech/bem/audio/03-201001-105646_bem_798_elicit_45.wav	nokutila katukaye tulefwila fwila mumpanga yaba mbulu matali
/home/skscla001/experiments/hf/speech/data/BembaSpeech/bem/audio/03-200920-120041_bem_798_elicit_9.wav	ukushupikwa pa kupeema
/home/skscla001/experiments/hf/speech/data/BembaSpeech/bem/audio/03-201006-011410_bem_798_elicit_30.wav	maria afumapo aya na filya apali abesukulu banankwe apo pene epo ayasanga na pauli ferdinand
/home/skscla001/experiments/hf/speech/data/BembaSpeech/bem/audio/03-201007-013831_bem_798_elicit_13.wav	alapila lelo aisaibikafye mu minwe yandi nga bantu bakwe aba akabacita shani kabili nomba basha bandi
/home/skscla001/experiments/hf/speech/data/BembaSpeech/bem/audio/04-200916-223805_bem_346_elicit_20.wav	finshi mulecita
/home/skscla001/experiments/hf/speech/data/BembaSpeech/bem/audio/04-201008-155010_bem_40e_elicit_9.wav	umwana akafyalwa muli lilye fumo akalaitwa ishina lya mutoto ilya ulya muntu afwile
/home/skscla001/experiments/hf/speech/data/BembaSpeech/bem/audio/03-200924-204525_bem_798_elicit_58.wav	ninshi muleibilafye mwebene amapalo ya ku mupashi
/home/skscla001/experiments/hf/speech/data/BembaSpeech/bem/audio/03-201006-013752_bem_798_elicit_35.wav	inshita nomba yasuka yakwanina iyakuti bamubatishe
/home/skscla001/experiments/hf/speech/data/BembaSpeech/bem/audio/03-200925-061220_bem_798_elicit_7.wav	muleibukisha ulya kolwe ipaka uweshina lya kaboba ali
/home/skscla001/experiments/hf/speech/data/BembaSpeech/bem/audio/03-200921-105818_bem_798_elicit_22.wav	nga cakuti mwalitandalilepo icaaalo ca china mu nshiku ikumi limo na shine ishapita
/home/skscla001/experiments/hf/speech/data/BembaSpeech/bem/audio/04-201005-211232_bem_40e_elicit_9.wav	abakalamba bamobamo basosela pamo abati icilibwe caleisuka kwati mwinshi na bantu baleingila mukati
/home/skscla001/experiments/hf/speech/data/BembaSpeech/bem/audio/03-201002-091908_bem_798_elicit_27.wav	mulandu nshi balefwaila nacisungu ukunina umufungo ukulosha amatako ku muulu umutwe panshi
/home/skscla001/experiments/hf/speech/data/BembaSpeech/bem/audio/04-200914-215055_bem_346_elicit_18.wav	webby ili elo ulefika
/home/skscla001/experiments/hf/speech/data/BembaSpeech/bem/audio/04-201008-153522_bem_40e_elicit_10.wav	balasosa ati bufi kano nefwe tumone nga tusumine
/home/skscla001/experiments/hf/speech/data/BembaSpeech/bem/audio/03-200923-215451_bem_798_elicit_47.wav	yali ninshita yakusakamikwa
/home/skscla001/experiments/hf/speech/data/BembaSpeech/bem/audio/03-200925-003120_bem_798_elicit_10.wav	kabili muli uku kubombela pamo emo balesalanganishisha ifitabo fyabo
/home/skscla001/experiments/hf/speech/data/BembaSpeech/bem/audio/03-201007-015856_bem_798_elicit_49.wav	ala mu mutwe mwali kwati umuntu anwine ubwalwa asuka alabako alampa no kutontonkanya pe tebulo
/home/skscla001/experiments/hf/speech/data/BembaSpeech/bem/audio/04-201012-174116_bmy_47d_elicit_8.wav	abantu tabalefwaya kwikala nangu bacimbile kano fye baya kumbi
/home/skscla001/experiments/hf/speech/data/BembaSpeech/bem/audio/04-201008-155438_bem_40e_elicit_3.wav	mulenga akulye atampile ku mukote umwanakashi
/home/skscla001/experiments/hf/speech/data/BembaSpeech/bem/audio/03-201006-025003_bem_798_elicit_38.wav	na bantu mu mushi aabak wete ubwalwa baleta kwa wongo kwine eko balanwena
/home/skscla001/experiments/hf/speech/data/BembaSpeech/bem/audio/09-200916-054405_bem_a40_elicit_22.wav	fumyeni iloba na fosholo
/home/skscla001/experiments/hf/speech/data/BembaSpeech/bem/audio/03-200925-010537_bem_798_elicit_2.wav	we cipendo nobe ulacepa ca misepela tuteyanya mu masambililo yakumine mu fyakukabila fyamikalile yaiko
/home/skscla001/experiments/hf/speech/data/BembaSpeech/bem/audio/03-200920-120041_bem_798_elicit_13.wav	ifyo ubulwele busalangana
/home/skscla001/experiments/hf/speech/data/BembaSpeech/bem/audio/03-200925-043821_bem_798_elicit_20.wav	ukupepa fwaka ukunwa na fimbipo lesa waluse ifyo acitile pali ine na imwe bene kuti abomba pa mweo wenu lesa te wakapatulula iyoo
/home/skscla001/experiments/hf/speech/data/BembaSpeech/bem/audio/03-200916-141341_bem_798_elicit_1.wav	imiti ikula empanga
/home/skscla001/experiments/hf/speech/data/BembaSpeech/bem/audio/03-201002-063230_bem_798_elicit_3.wav	icipata ca ng'anda yamulungu ekutila shaani
/home/skscla001/experiments/hf/speech/data/BembaSpeech/bem/audio/03-200924-214522_bem_798_elicit_19.wav	ifintu fifuma mwisenge efyaba ifikalamba
/home/skscla001/experiments/hf/speech/data/BembaSpeech/bem/audio/04-201008-155438_bem_40e_elicit_8.wav	ati mayo kapooli ifyo alendila imbalala mu ibala awe mwandi teti utemwe
/home/skscla001/experiments/hf/speech/data/BembaSpeech/bem/audio/03-201002-054811_bem_798_elicit_19.wav	awe acusha aiba nefipe fyonse kumo nencinga panuma yakwikala nankwe  umwaka umo nemyeshi mutanda
/home/skscla001/experiments/hf/speech/data/BembaSpeech/bem/audio/07-200916-171635_bem_c20_elicit_15.wav	awe mwane ayabuula na ubulanda bwamwinamwakwe
/home/skscla001/experiments/hf/speech/data/BembaSpeech/bem/audio/03-200923-230549_bem_798_elicit_37.wav	leka cibe ukutila ilintu wasangwa mukupusana na bantu bambi te iwe ufitendeke
/home/skscla001/experiments/hf/speech/data/BembaSpeech/bem/audio/03-201007-015856_bem_798_elicit_31.wav	ku kabara nako ahbudula ashala afwa
/home/skscla001/experiments/hf/speech/data/BembaSpeech/bem/audio/03-200916-133712_bem_798_elicit_4.wav	akacila kambushi kasengula epo kekele
/home/skscla001/experiments/hf/speech/data/BembaSpeech/bem/audio/03-200916-033028_bem_798_elicit_16.wav	nangu umuntu abe shani ne shamo nangu aculeni shani apofye muntu tali wakuseka
/home/skscla001/experiments/hf/speech/data/BembaSpeech/bem/audio/03-200921-214144_bem_798_elicit_27.wav	tumineni akabungwe ka kupilibula no kwalula ifitundu pa one three one four five zero
/home/skscla001/experiments/hf/speech/data/BembaSpeech/bem/audio/03-200924-204525_bem_798_elicit_38.wav	ukukanaba bwinokwesu kuti kwaba ukwamishiwa
/home/skscla001/experiments/hf/speech/data/BembaSpeech/bem/audio/03-201001-105646_bem_798_elicit_20.wav	kufunda ukusalapukaukuba uwakampuka mukucita ifintu
/home/skscla001/experiments/hf/speech/data/BembaSpeech/bem/audio/04-200916-232841_bem_346_elicit_6.wav	tulefwaya asambilile ukulanda cisungu
/home/skscla001/experiments/hf/speech/data/BembaSpeech/bem/audio/03-200921-114142_bem_798_elicit_33.wav	kuti mwatumina ba kapokola ba calo ca australia ba australian federal police afp pa one three one two three seven one three one afp
/home/skscla001/experiments/hf/speech/data/BembaSpeech/bem/audio/03-200916-010158_bem_798_elicit_28.wav	pantu fintu ifyo abafyashi babo babasambilishe
/home/skscla001/experiments/hf/speech/data/BembaSpeech/bem/audio/03-200925-043821_bem_798_elicit_35.wav	nga mulekabila ukusendamo ulubali muli uku kucimfyanya tumeni ifilefwaikwa apa pesamba kuli ba editor ukushinta pa fifteen october two thousand and nine
/home/skscla001/experiments/hf/speech/data/BembaSpeech/bem/audio/03-201004-110412_bem_798_elicit_46.wav	kanshi lilya line bamusendele bailemutwala ku lucengo lwa mipashi yabo
/home/skscla001/experiments/hf/speech/data/BembaSpeech/bem/audio/03-200924-194133_bem_798_elicit_49.wav	ifi efyacitike kuli yesu pa capindama kabili efyacitike kuli dabidi
/home/skscla001/experiments/hf/speech/data/BembaSpeech/bem/audio/04-200917-143010_bem_346_elicit_33.wav	na mu cisungu tamwishibe
/home/skscla001/experiments/hf/speech/data/BembaSpeech/bem/audio/03-200916-133712_bem_798_elicit_34.wav	imiti ipalamene taibula kukwesana
/home/skscla001/experiments/hf/speech/data/BembaSpeech/bem/audio/03-201006-003654_bem_798_elicit_30.wav	kwa mwine mushi uko ashifikafye bamuteka na pa butanda panse pakuti abantu bese bamutambe
/home/skscla001/experiments/hf/speech/data/BembaSpeech/bem/audio/03-201004-110412_bem_798_elicit_34.wav	ala cabukaili eco baline kutifye apakukanina e pabulile
/home/skscla001/experiments/hf/speech/data/BembaSpeech/bem/audio/04-201009-110829_bem_40e_elicit_20.wav	mateo ico aumfwile mu kufundwa uko umupatili afundile ati kaino mwana adam aipeye umwaice wakwe abeli ico amufimbile pa kuwamya kwakwe
/home/skscla001/experiments/hf/speech/data/BembaSpeech/bem/audio/03-200921-112400_bem_798_elicit_11.wav	ukupatikisha umuntu uuli onse ukupanga icupo nangu ukucita ifili fyonse ifyapala mukupanga icupo
/home/skscla001/experiments/hf/speech/data/BembaSpeech/bem/audio/04-201008-160002_bem_40e_elicit_4.wav	nakasofu amona umulongo wa tente kuntanshi cilya ati alenukula amona umuntu umo kuntanshi aleluka teshibe ukuti ni mulenga wa mpanga ena ati munandi
/home/skscla001/experiments/hf/speech/data/BembaSpeech/bem/audio/03-200921-105818_bem_798_elicit_53.wav	ukwikata inama iikwete akashiishi ka kolona atemwa ukwikata ifyakulya fimbi ifilefuma kuli iyo nama
/home/skscla001/experiments/hf/speech/data/BembaSpeech/bem/audio/03-201004-110412_bem_798_elicit_44.wav	papitile inshiku shine talya nakulya alangulukafye
/home/skscla001/experiments/hf/speech/data/BembaSpeech/bem/audio/03-200921-160552_bem_798_elicit_4.wav	ngacakuti imwe nangu umuntu umbi untu mwaishiba ali mu busanso tumineni ba kapokola pali zero zero zero
/home/skscla001/experiments/hf/speech/data/BembaSpeech/bem/audio/03-201002-091908_bem_798_elicit_17.wav	ni ulya uuba cimbwi atemwa mukolwe nga balebuta nabanakwe
/home/skscla001/experiments/hf/speech/data/BembaSpeech/bem/audio/03-200924-214522_bem_798_elicit_42.wav	mu cilangililo kuti walanga shani ukutemwa nangu ukusekelela nangu ukuteka umutima nangu uluse ilyo uli weka mu muputule obe
/home/skscla001/experiments/hf/speech/data/BembaSpeech/bem/audio/03-200925-061220_bem_798_elicit_9.wav	aishileba icakulya cakuipakisha ing'wena ka
/home/skscla001/experiments/hf/speech/data/BembaSpeech/bem/audio/04-201008-151412_bem_40e_elicit_9.wav	no bushe ilyo babwelela ku mushi bayashimikila abanabo ifyo mulenga alima
/home/skscla001/experiments/hf/speech/data/BembaSpeech/bem/audio/07-200916-171635_bem_c20_elicit_4.wav	umulume nao amupeela na ifumo ati twalila batata ifumo lyabo ili
/home/skscla001/experiments/hf/speech/data/BembaSpeech/bem/audio/04-200916-223805_bem_346_elicit_19.wav	elo watoloka nakabili toloka elo wimbe
/home/skscla001/experiments/hf/speech/data/BembaSpeech/bem/audio/03-200921-154823_bem_798_elicit_5.wav	ukubomfya kwa mpango ukwine fye temutitikisha iyo
/home/skscla001/experiments/hf/speech/data/BembaSpeech/bem/audio/03-201004-122608_bem_798_elicit_26.wav	ni nshita yakuilanga ubwaume bwinebwine
/home/skscla001/experiments/hf/speech/data/BembaSpeech/bem/audio/03-201003-235942_bem_798_elicit_13.wav	ali umusungu umusuma saana tali ne congo nakalya
/home/skscla001/experiments/hf/speech/data/BembaSpeech/bem/audio/04-201008-155438_bem_40e_elicit_21.wav	ne wabikako amano uleumfwa pakuti kawe abanakashi balekasosa ne miku umwanda
/home/skscla001/experiments/hf/speech/data/BembaSpeech/bem/audio/03-200921-160552_bem_798_elicit_12.wav	ukuuma
/home/skscla001/experiments/hf/speech/data/BembaSpeech/bem/audio/03-201004-122608_bem_798_elicit_1.wav	cila muntu aliikwete umwando wakwe uo aaposele uutali saana uo aleckaka ku cimuti cimo cili patalipatali
/home/skscla001/experiments/hf/speech/data/BembaSpeech/bem/audio/03-200916-142856_bem_798_elicit_20.wav	umulandu ngawapitila pamputi napa ulondolola ukupitila pamputi
/home/skscla001/experiments/hf/speech/data/BembaSpeech/bem/audio/03-200916-015847_bem_798_elicit_8.wav	ilelo imishi yabo ne calo cesu ca congo ngatabafibombeele ngefyo balecita pabushiku bwelelo
/home/skscla001/experiments/hf/speech/data/BembaSpeech/bem/audio/03-200924-200908_bem_798_elicit_1.wav	alwile mukuicetekela no kwipaya icilwani
/home/skscla001/experiments/hf/speech/data/BembaSpeech/bem/audio/03-200925-003120_bem_798_elicit_3.wav	ilyo tuli ne senge ilyacincila mu cilonganino e nshila ya kutungilila no kukoseleshamo umo no munankwe
/home/skscla001/experiments/hf/speech/data/BembaSpeech/bem/audio/04-200917-201407_bem_346_elicit_13.wav	shani  ulishani'
/home/skscla001/experiments/hf/speech/data/BembaSpeech/bem/audio/03-200916-010158_bem_798_elicit_4.wav	kanshi ngatwamona imibele yaba katumbi naba katumba ngatwauumfwa insosele shabo ngatwalolekesha imifwalilo yabo
/home/skscla001/experiments/hf/speech/data/BembaSpeech/bem/audio/07-200916-171635_bem_c20_elicit_11.wav	imfumu ileumfwafye uko abantu balecita icongo
/home/skscla001/experiments/hf/speech/data/BembaSpeech/bem/audio/03-201002-085315_bem_798_elicit_14.wav	naani waishile kobekela vera paskale
/home/skscla001/experiments/hf/speech/data/BembaSpeech/bem/audio/04-201005-204642_bem_40e_elicit_4.wav	aba bene bakalamba balesosa abati mulenga takafwe pantu lesa alimulemba icishibile icakukanaipaiwa
/home/skscla001/experiments/hf/speech/data/BembaSpeech/bem/audio/03-201004-103454_bem_798_elicit_8.wav	shikanofye uo bashishukile
/home/skscla001/experiments/hf/speech/data/BembaSpeech/bem/audio/03-201007-011712_bem_798_elicit_18.wav	teti ibele ukuti umuntu umupabi kabili uushili mutundu wabo eo ope maria iyoo
/home/skscla001/experiments/hf/speech/data/BembaSpeech/bem/audio/03-201007-015856_bem_798_elicit_50.wav	amona yakwana alafuma nokuya mu muputule wa kusendamamo
/home/skscla001/experiments/hf/speech/data/BembaSpeech/bem/audio/03-200921-143443_bem_798_elicit_1.wav	ukupatikisha uuli onse ukuupa nangu ukuupwa mulandu uukulu saana mu australia
/home/skscla001/experiments/hf/speech/data/BembaSpeech/bem/audio/03-200915-234914_bem_798_elicit_37.wav	tutontokanya mu lulimi lwesu  elutulanga na mano ne mimwenene
/home/skscla001/experiments/hf/speech/data/BembaSpeech/bem/audio/03-201006-002050_bem_798_elicit_20.wav	awe na mukenda na kaitali abali nokukanya bashumfwefyo bebele twashuka nomba no bufumu bwine twalila twapoka
/home/skscla001/experiments/hf/speech/data/BembaSpeech/bem/audio/03-201006-013752_bem_798_elicit_36.wav	ubushiku bwine bwa lubatisho shamitombo acelele kwa anatole ali uleke nje nkungule anatole ayenjimininako ku lubatisho
/home/skscla001/experiments/hf/speech/data/BembaSpeech/bem/audio/04-200917-142312_bem_346_elicit_40.wav	cimofye icintu batemenwe mukati ka iyi temu
/home/skscla001/experiments/hf/speech/data/BembaSpeech/bem/audio/03-200925-010537_bem_798_elicit_10.wav	twamwene ifyo atantike pakuisosela umwine ku bayuda banankwe mu lulimi ulo baleumfwa elyo no mucinshi wali mu kulanda kwakwe
/home/skscla001/experiments/hf/speech/data/BembaSpeech/bem/audio/07-200916-164857_bem_c20_elicit_32.wav	nomba twashala ukuyombawila
/home/skscla001/experiments/hf/speech/data/BembaSpeech/bem/audio/04-200917-201407_bem_346_elicit_2.wav	elo balanda ati 'shani' uleumfwa
/home/skscla001/experiments/hf/speech/data/BembaSpeech/bem/audio/03-200916-141341_bem_798_elicit_33.wav	ulukuni lumo talwaka
/home/skscla001/experiments/hf/speech/data/BembaSpeech/bem/audio/03-201001-105646_bem_798_elicit_0.wav	apa shikulu atile naibukisha imfwa ya fwile shikulwifwe
/home/skscla001/experiments/hf/speech/data/BembaSpeech/bem/audio/03-201002-054811_bem_798_elicit_40.wav	amalipilo yalifye ayaciwele wele
/home/skscla001/experiments/hf/speech/data/BembaSpeech/bem/audio/03-201007-015856_bem_798_elicit_33.wav	koyikoyi ena takokwele kulindila ahbudula kuti abwele iyoo
/home/skscla001/experiments/hf/speech/data/BembaSpeech/bem/audio/04-200917-142312_bem_346_elicit_26.wav	eya iwe
/home/skscla001/experiments/hf/speech/data/BembaSpeech/bem/audio/03-200918-110406_bem_798_elicit_14.wav	tulebapokololako kuli bonse abalesuusha amashina yabo
/home/skscla001/experiments/hf/speech/data/BembaSpeech/bem/audio/04-200914-220511_bem_346_elicit_29.wav	ulelanda ati mu cisoli fye
/home/skscla001/experiments/hf/speech/data/BembaSpeech/bem/audio/03-201007-004908_bem_798_elicit_20.wav	umushi onse ninshi basoweshafye abau shamitombo bakamupo bukalamba
/home/skscla001/experiments/hf/speech/data/BembaSpeech/bem/audio/03-200923-230549_bem_798_elicit_45.wav	bushe abantu abali muli ubu bwafya baletontonkanyapo shani
/home/skscla001/experiments/hf/speech/data/BembaSpeech/bem/audio/04-201005-211232_bem_40e_elicit_4.wav	aipula inama na pa mulilo alashipoosa pa menshi yasuka inombe yonse yapwa
/home/skscla001/experiments/hf/speech/data/BembaSpeech/bem/audio/03-200921-165915_bem_798_elicit_5.wav	elyo no bwampano bobe bwapwa
/home/skscla001/experiments/hf/speech/data/BembaSpeech/bem/audio/03-200923-230549_bem_798_elicit_41.wav	nga cakuti waumfwa palwa bwafya camano ukufwailisha
/home/skscla001/experiments/hf/speech/data/BembaSpeech/bem/audio/03-201004-110412_bem_798_elicit_22.wav	uyu muntu nga twali tumwipaye ala tatwakalukunte
/home/skscla001/experiments/hf/speech/data/BembaSpeech/bem/audio/04-201005-212105_bem_40e_elicit_6.wav	kabili na kuli mayo nindaya nati nshabwele akasuba nako nakawa
/home/skscla001/experiments/hf/speech/data/BembaSpeech/bem/audio/03-201001-100406_bem_798_elicit_26.wav	leelo ilyo baishile balicitile ifya maano nganshi
/home/skscla001/experiments/hf/speech/data/BembaSpeech/bem/audio/03-200925-050356_bem_798_elicit_49.wav	no lupwa lonse lulatotela
/home/skscla001/experiments/hf/speech/data/BembaSpeech/bem/audio/03-201006-013752_bem_798_elicit_23.wav	icungulo abwelelefye kwa anatole ku nanda
/home/skscla001/experiments/hf/speech/data/BembaSpeech/bem/audio/03-200924-194133_bem_798_elicit_35.wav	lelo mulandu nshi
/home/skscla001/experiments/hf/speech/data/BembaSpeech/bem/audio/03-201006-021353_bem_798_elicit_4.wav	alesubilo kuti nkashinankwe akafwa
/home/skscla001/experiments/hf/speech/data/BembaSpeech/bem/audio/03-200925-010537_bem_798_elicit_53.wav	bushiku bumo naile pa cililo icali mu mushi
