audio	sentence
/home/skscla001/experiments/hf/speech/data/BembaSpeech/bem/audio/03-200921-162447_bem_798_elicit_6.wav	elyo ukubakankamba mulandu nganshi
/home/skscla001/experiments/hf/speech/data/BembaSpeech/bem/audio/09-200916-054405_bem_a40_elicit_47.wav	ndemona kwati takuli kutapa menshi lelo
/home/skscla001/experiments/hf/speech/data/BembaSpeech/bem/audio/03-201002-051828_bem_798_elicit_8.wav	abati nineni awe twanina kuti ukufika pakati awe nemfubu yaisa pandula kabwato bonse twawila namumenshi umukuku nao watusenda uku noku
/home/skscla001/experiments/hf/speech/data/BembaSpeech/bem/audio/04-201005-212919_bem_40e_elicit_19.wav	muyeeba bashamfumu ukuti aba bakalimamalungu nga mwabacimfya teti mubateeke kuti mwabeba bayafwaye calo kumbi
/home/skscla001/experiments/hf/speech/data/BembaSpeech/bem/audio/03-201004-122608_bem_798_elicit_24.wav	pantu bali no kwikala uyu cka no yu eka mu ncengo shilya shine balengula kale
/home/skscla001/experiments/hf/speech/data/BembaSpeech/bem/audio/03-200924-200908_bem_798_elicit_34.wav	bushe kuli umuntu uuleipatikisha mu cupo cenu pakuti amulekanye
/home/skscla001/experiments/hf/speech/data/BembaSpeech/bem/audio/04-201008-154234_bem_40e_elicit_3.wav	abaice batatu bali mu tulo mu mushi wa canakampasa
/home/skscla001/experiments/hf/speech/data/BembaSpeech/bem/audio/03-200918-110406_bem_798_elicit_28.wav	twibukishe insoselo sha bakulu akali ku kanwa kakulu
/home/skscla001/experiments/hf/speech/data/BembaSpeech/bem/audio/03-200916-120506_bem_798_elicit_34.wav	ukulingana nokupenda kwa kwa lesa ubu ebushiku bwakutendekelapo umulungu
/home/skscla001/experiments/hf/speech/data/BembaSpeech/bem/audio/03-200916-010158_bem_798_elicit_39.wav	na mashina yabalupwa babo abashala ku mushi wabo
/home/skscla001/experiments/hf/speech/data/BembaSpeech/bem/audio/04-200916-223805_bem_346_elicit_27.wav	pantu ama buku yakwa farai
/home/skscla001/experiments/hf/speech/data/BembaSpeech/bem/audio/03-200925-010537_bem_798_elicit_23.wav	tuleeba abantu pafyo lesa abomba nefyo twapitilemo nefyo apilibula umweo wandi pakuti abantu beshibe amaka yakwa lesa nefyo abomba
/home/skscla001/experiments/hf/speech/data/BembaSpeech/bem/audio/03-200916-141341_bem_798_elicit_21.wav	twende babili temwenso kusosha nya
/home/skscla001/experiments/hf/speech/data/BembaSpeech/bem/audio/03-200924-200908_bem_798_elicit_5.wav	dabidi alisubilwe ukuba imfumu ya bantu bakwe mu nshita sha kuntanshi kabili ukufuma bulya bushiku mupashi wakwa lesa ali pali wene mu maka
/home/skscla001/experiments/hf/speech/data/BembaSpeech/bem/audio/03-200916-033028_bem_798_elicit_8.wav	ngacakuti twaipushisha ba katumbi naba katumba muli fyonse ifyo bacita kuti batweeba ifyo bamwali wabo baba ba mpandamano wabo
/home/skscla001/experiments/hf/speech/data/BembaSpeech/bem/audio/03-201004-110412_bem_798_elicit_19.wav	bekala ku blueville ku manika fye kutali uku
/home/skscla001/experiments/hf/speech/data/BembaSpeech/bem/audio/03-201004-091537_bem_798_elicit_19.wav	e pakulaye cilayo bebele nga twalwishe nkondo na imwe ninshi ubweni bwenu bwapwa mwaba muli bakaya bape
/home/skscla001/experiments/hf/speech/data/BembaSpeech/bem/audio/03-201006-013752_bem_798_elicit_17.wav	panuma ya myeshi fye mutanda asuka apwisha fyonse bwinobwino
/home/skscla001/experiments/hf/speech/data/BembaSpeech/bem/audio/03-201004-001734_bem_798_elicit_30.wav	nga neci abantu bakulya abalapepa inama sha mu mimana bena ni mfumu awe cabwela caisha no mwana
/home/skscla001/experiments/hf/speech/data/BembaSpeech/bem/audio/03-200916-015847_bem_798_elicit_31.wav	leelo kumwafwa ukulingana napalingile amaka yakwe
/home/skscla001/experiments/hf/speech/data/BembaSpeech/bem/audio/03-201004-122608_bem_798_elicit_12.wav	ninshi baciule tu mukolwe
/home/skscla001/experiments/hf/speech/data/BembaSpeech/bem/audio/03-200925-062606_bem_798_elicit_51.wav	ecalenga mukuya kwa nshita kashitisha onse akalasenda impendwa ya fitabo ifyalingana no mutengo wa ndalama ashitishe mu fitabo fyalekelesheko
/home/skscla001/experiments/hf/speech/data/BembaSpeech/bem/audio/03-200924-200908_bem_798_elicit_27.wav	lelo mupashi wa mushilo ali muli ifwe kabili nga cakuti tuli nao ninshi natukwata intulo ya maka yonse na mano yantu tulekabila kukulwa ubulwi ubuli bonse mu myeo yesu
/home/skscla001/experiments/hf/speech/data/BembaSpeech/bem/audio/03-200921-165915_bem_798_elicit_9.wav	umuntu uwacita iyi milandu kuti atwalwa kucifungo cibe mwaume nangu mwanakashi
/home/skscla001/experiments/hf/speech/data/BembaSpeech/bem/audio/03-201007-022920_bem_798_elicit_12.wav	maria tafwile iyoo
/home/skscla001/experiments/hf/speech/data/BembaSpeech/bem/audio/04-201005-212105_bem_40e_elicit_20.wav	ashipwa fye ukupepa ne cilibwe caisuka afumina na panse
/home/skscla001/experiments/hf/speech/data/BembaSpeech/bem/audio/04-200914-215055_bem_346_elicit_16.wav	nomba kuti mwalanda 'shalenipo' kuli ine
/home/skscla001/experiments/hf/speech/data/BembaSpeech/bem/audio/03-200916-040939_bem_798_elicit_2.wav	e bumuntu
/home/skscla001/experiments/hf/speech/data/BembaSpeech/bem/audio/03-200924-222234_bem_798_elicit_19.wav	aba mutima umo e kumfwana ukusangwa pa fibusa abo abofwana mumikalile yabo iyapalana
/home/skscla001/experiments/hf/speech/data/BembaSpeech/bem/audio/03-201002-091908_bem_798_elicit_16.wav	bushe umwaice uwinga shishita wamusango shaani
/home/skscla001/experiments/hf/speech/data/BembaSpeech/bem/audio/03-201006-013752_bem_798_elicit_32.wav	kutifye apo apita aumfwa abati ni ba mangala
/home/skscla001/experiments/hf/speech/data/BembaSpeech/bem/audio/03-200916-040939_bem_798_elicit_39.wav	mufyo bacita no kufkilisha ifilayo fyabo bafwile ukwishiba ukuti akakubika kalasasa  icakucita ilelo tecakutwala mailo
/home/skscla001/experiments/hf/speech/data/BembaSpeech/bem/audio/04-201009-122744_bem_40e_elicit_34.wav	aleti fye uyu apa ne nama yakwe alekomaula
/home/skscla001/experiments/hf/speech/data/BembaSpeech/bem/audio/07-200916-164857_bem_c20_elicit_45.wav	elyo yaeba abantu aiti shimyeni umulilo
/home/skscla001/experiments/hf/speech/data/BembaSpeech/bem/audio/04-201008-154234_bem_40e_elicit_5.wav	chilufya ali e mwine we tanda emo ababiye baleisa mu kusendama chilufya alota inkalamo ilemutamfya
/home/skscla001/experiments/hf/speech/data/BembaSpeech/bem/audio/03-200920-120041_bem_798_elicit_8.wav	icifuba
/home/skscla001/experiments/hf/speech/data/BembaSpeech/bem/audio/07-200916-171635_bem_c20_elicit_49.wav	kakalulu uko kaali kati komfwe kaima na ukwima kalaisa na kumusumba
/home/skscla001/experiments/hf/speech/data/BembaSpeech/bem/audio/03-201006-025003_bem_798_elicit_7.wav	asuka koyikoyi ayawila mu cimukanda umo mwine emo no kulu kwaputukila
/home/skscla001/experiments/hf/speech/data/BembaSpeech/bem/audio/03-201006-015824_bem_798_elicit_25.wav	ubucushi nga bwati bukuponene ala bulashisha
/home/skscla001/experiments/hf/speech/data/BembaSpeech/bem/audio/04-201009-110017_bem_40e_elicit_29.wav	awe aiposapo aibila ca yandalala no kwandalala
/home/skscla001/experiments/hf/speech/data/BembaSpeech/bem/audio/03-200925-050356_bem_798_elicit_13.wav	mukwai kwali kensha we shitima na umbi uwaishile uyo uwalelongana kale ku christian brethren
/home/skscla001/experiments/hf/speech/data/BembaSpeech/bem/audio/03-201002-051828_bem_798_elicit_19.wav	banangile mu nganada namba one forty four
/home/skscla001/experiments/hf/speech/data/BembaSpeech/bem/audio/03-201002-054811_bem_798_elicit_22.wav	nasuka nakuncito nashota
/home/skscla001/experiments/hf/speech/data/BembaSpeech/bem/audio/03-201002-085315_bem_798_elicit_25.wav	pio ayafwilishe uyu namaayo uo ndume yakwe aleikala ku kitwe uyo kabili uushanyantile nolukasa ku ndola uko nkanshi yakwe  aali nomwana
/home/skscla001/experiments/hf/speech/data/BembaSpeech/bem/audio/03-200921-143443_bem_798_elicit_12.wav	ngacakuti imwe nangu umuntu umbi untu mwaishiba ali mu busanso tumineni ba kapokola pali zero zero zero
/home/skscla001/experiments/hf/speech/data/BembaSpeech/bem/audio/09-200916-054405_bem_a40_elicit_34.wav	elyo kabili tecakwesha ukunyanta pa mpela ya cishima cabula inkupiko pantu kuti waleka iloba lyasunikila mukati atemwa juti wawilamo
/home/skscla001/experiments/hf/speech/data/BembaSpeech/bem/audio/04-201009-122744_bem_40e_elicit_20.wav	kulya mulenga ele abuula ilampi lya bubill
/home/skscla001/experiments/hf/speech/data/BembaSpeech/bem/audio/03-200924-200908_bem_798_elicit_47.wav	nomba dabidi talelwa amabulwi yonse kwaleba inshita isho calelingafye ukufulumuka
/home/skscla001/experiments/hf/speech/data/BembaSpeech/bem/audio/03-200925-053533_bem_798_elicit_19.wav	tulingile ukwipusha amepusho pakuti twingeshiba ngacakuti uyo muntu alishiba imbila nsuma
/home/skscla001/experiments/hf/speech/data/BembaSpeech/bem/audio/03-201007-013831_bem_798_elicit_41.wav	ba shamitombo no mukashi bena baya na ku ofeshi ku kufisha lipoti
/home/skscla001/experiments/hf/speech/data/BembaSpeech/bem/audio/04-201009-110017_bem_40e_elicit_11.wav	lelo nga apepapo icani conse cayandililapo cayanduluka catanda buka caba nomba cishiba icabuuta tutu icikalamba
/home/skscla001/experiments/hf/speech/data/BembaSpeech/bem/audio/03-201007-015856_bem_798_elicit_66.wav	kati nokuu wafwilapo nobe pa bupulumushi bobe
/home/skscla001/experiments/hf/speech/data/BembaSpeech/bem/audio/03-201006-013752_bem_798_elicit_24.wav	atampa no kumushimikila ifyo bamwebele ku ofeshi
/home/skscla001/experiments/hf/speech/data/BembaSpeech/bem/audio/03-200925-043821_bem_798_elicit_2.wav	lelo ilyo aileshita saimoni uwamuletele ali cibulu
/home/skscla001/experiments/hf/speech/data/BembaSpeech/bem/audio/03-200925-062606_bem_798_elicit_1.wav	kabili abatetekela bonse baba muli uyu mubili nelyo bengaba mu nkuta shesu nangu mu nkuta shimbi
/home/skscla001/experiments/hf/speech/data/BembaSpeech/bem/audio/03-200924-194133_bem_798_elicit_33.wav	dabidi nakwata ubuyo muli ubu bulwi
/home/skscla001/experiments/hf/speech/data/BembaSpeech/bem/audio/03-201007-002328_bem_798_elicit_46.wav	kutifye cilya balongana kamo akashilika katipo ne cisongo pu fyaisapunkana fyatipo na mpu mpu
/home/skscla001/experiments/hf/speech/data/BembaSpeech/bem/audio/03-200924-204525_bem_798_elicit_59.wav	ukushinshimuna lesa
/home/skscla001/experiments/hf/speech/data/BembaSpeech/bem/audio/03-201006-011410_bem_798_elicit_46.wav	lyena na basungu baka ba mucele
/home/skscla001/experiments/hf/speech/data/BembaSpeech/bem/audio/04-200916-223805_bem_346_elicit_41.wav	pantu ukalafwaya ukubamona lyonsefye
/home/skscla001/experiments/hf/speech/data/BembaSpeech/bem/audio/04-201009-122744_bem_40e_elicit_5.wav	umo aleya kwati te kasuba ku kubuta kwa cangelo ca lampi wakwe
/home/skscla001/experiments/hf/speech/data/BembaSpeech/bem/audio/03-200915-234914_bem_798_elicit_42.wav	mutwe uletontonkanye fisuma elo ulefwaya nokumona ku menso fyonse ifyo ulepekanya
/home/skscla001/experiments/hf/speech/data/BembaSpeech/bem/audio/03-201006-011410_bem_798_elicit_35.wav	akonkelelefye co cine abantu bawamisha ku mutima ebele na ine ku calici nshakulapuswako
/home/skscla001/experiments/hf/speech/data/BembaSpeech/bem/audio/03-200916-033028_bem_798_elicit_20.wav	ba katumbi na ba katumba bantu nabo ilyo balekula bapitile mu mafia ayalekanalekana
/home/skscla001/experiments/hf/speech/data/BembaSpeech/bem/audio/03-200924-181036_bem_798_elicit_3.wav	uyu mutumfyo euntu dabidi aletila lisebanya
/home/skscla001/experiments/hf/speech/data/BembaSpeech/bem/audio/03-201006-015824_bem_798_elicit_2.wav	ba kapokola baishile nabanunka na nuu
/home/skscla001/experiments/hf/speech/data/BembaSpeech/bem/audio/03-201007-013831_bem_798_elicit_11.wav	elyo lufonsho amushentenka ati
/home/skscla001/experiments/hf/speech/data/BembaSpeech/bem/audio/04-201008-155438_bem_40e_elicit_12.wav	umukote ulya ati nabapela mulenga abalye
/home/skscla001/experiments/hf/speech/data/BembaSpeech/bem/audio/03-201007-002328_bem_798_elicit_37.wav	aalefwayafye kuti amukonke pakuti amumweneshe umo aalepita monse
/home/skscla001/experiments/hf/speech/data/BembaSpeech/bem/audio/03-201004-001734_bem_798_elicit_6.wav	umusungu na bantu bakwe bati bamonekofye ifyo abati twafwa lelo
/home/skscla001/experiments/hf/speech/data/BembaSpeech/bem/audio/03-200924-214522_bem_798_elicit_3.wav	kabili lesa alamona isenge lya bana bakwe
/home/skscla001/experiments/hf/speech/data/BembaSpeech/bem/audio/04-200914-220511_bem_346_elicit_28.wav	nga catuti abana balesambilila muci soli
/home/skscla001/experiments/hf/speech/data/BembaSpeech/bem/audio/03-200925-061220_bem_798_elicit_13.wav	akwaba icintu icitwa ing'wena
/home/skscla001/experiments/hf/speech/data/BembaSpeech/bem/audio/04-200914-220511_bem_346_elicit_23.wav	tapali nafimbi efyo fye
/home/skscla001/experiments/hf/speech/data/BembaSpeech/bem/audio/03-201006-013752_bem_798_elicit_28.wav	ni ba mangala bafite cibi alekwipushisha alefwaya kuti ukabalunge
/home/skscla001/experiments/hf/speech/data/BembaSpeech/bem/audio/03-200920-120041_bem_798_elicit_32.wav	sambeni ku minwe libililibili ukubomfya isopo na menshi ayabusaka atemwa kuti mwabomfya umuti wa kusuba ku minwe uwakwipaya utushiishi
/home/skscla001/experiments/hf/speech/data/BembaSpeech/bem/audio/03-201004-103454_bem_798_elicit_41.wav	imfubu nasho ashiti twafwa mwe
/home/skscla001/experiments/hf/speech/data/BembaSpeech/bem/audio/03-201007-004908_bem_798_elicit_28.wav	bulya bushiku nali ku mfumu ku kumonana na ba hugo
/home/skscla001/experiments/hf/speech/data/BembaSpeech/bem/audio/03-200924-181036_bem_798_elicit_8.wav	kwaliba inshita isho umuntu engafulumuka ubwafya ne nshita isho umuntu engasuula kabili kwaba ne nshita isho umuntu alingile ukulolenkana no bwafya
/home/skscla001/experiments/hf/speech/data/BembaSpeech/bem/audio/03-200924-204525_bem_798_elicit_14.wav	nga mu cilangililo kuli ibumba ilitwa ilino isenge lya bakatangata abena kristunabambi betwa isenge lya basambi abatetekela mu zambia
/home/skscla001/experiments/hf/speech/data/BembaSpeech/bem/audio/03-201002-051828_bem_798_elicit_31.wav	ubuce bwamayanda buleeta ubupulumushi
/home/skscla001/experiments/hf/speech/data/BembaSpeech/bem/audio/03-201006-002050_bem_798_elicit_7.wav	pantu aleafwaya ukwenda amapanga nao nge fyaendele wishi
/home/skscla001/experiments/hf/speech/data/BembaSpeech/bem/audio/03-201007-013831_bem_798_elicit_20.wav	pa mwinshi kanshi bakumaninafye na musa nao elyo afika
/home/skscla001/experiments/hf/speech/data/BembaSpeech/bem/audio/03-200916-133712_bem_798_elicit_24.wav	ifilala fyamunda yanama
/home/skscla001/experiments/hf/speech/data/BembaSpeech/bem/audio/03-200916-015847_bem_798_elicit_37.wav	twilabomfwila icipyu pakumona ukuti ba afwako bakantwa elo ifwe tabatwafwile
/home/skscla001/experiments/hf/speech/data/BembaSpeech/bem/audio/04-201008-151412_bem_40e_elicit_18.wav	nalimo kuti nacimfya abalwani bandi
/home/skscla001/experiments/hf/speech/data/BembaSpeech/bem/audio/04-200916-232841_bem_346_elicit_22.wav	nimbona ati aleyafye pa ntanshi muli fimbi fintu
/home/skscla001/experiments/hf/speech/data/BembaSpeech/bem/audio/03-201004-001734_bem_798_elicit_7.wav	epakulishe mfuti cipamanso mu mulu bati na pu
/home/skscla001/experiments/hf/speech/data/BembaSpeech/bem/audio/07-200916-171635_bem_c20_elicit_40.wav	abantu pakumfwa abati we mfumu citafye lelo line
/home/skscla001/experiments/hf/speech/data/BembaSpeech/bem/audio/04-200917-142312_bem_346_elicit_37.wav	tuleisala mailo tefyo
/home/skscla001/experiments/hf/speech/data/BembaSpeech/bem/audio/03-201007-004908_bem_798_elicit_38.wav	lilya waishile mukulosha anastasia lyena mwlandi caisha no mwana
/home/skscla001/experiments/hf/speech/data/BembaSpeech/bem/audio/03-200916-015847_bem_798_elicit_46.wav	mukufikana no kufwaya fimbi ukalufya nako ukweteko
/home/skscla001/experiments/hf/speech/data/BembaSpeech/bem/audio/03-200921-114142_bem_798_elicit_41.wav	one eight zero zero respect kabungwe kamu calo ca australia akabombela mukupanda amano mu milandu ya kulungana nabantu ku maka elyo no bunkalwe no mutitikisha mu mayanda
/home/skscla001/experiments/hf/speech/data/BembaSpeech/bem/audio/03-200916-033028_bem_798_elicit_33.wav	mu lubumbashi ba katumbi tabalolela mu ng'anda ya ncito yabo pakuti umuntu ese abebe ifyo ncito ileenda
/home/skscla001/experiments/hf/speech/data/BembaSpeech/bem/audio/03-200921-214144_bem_798_elicit_22.wav	nangu limbi muletontonkanya ukuti uyo muntu kuti aba mubwafya bwa kusendwa kunse ya calo pakuti baye musembulula
/home/skscla001/experiments/hf/speech/data/BembaSpeech/bem/audio/04-201005-205341_bem_40e_elicit_0.wav	mulenga afuma kwi
/home/skscla001/experiments/hf/speech/data/BembaSpeech/bem/audio/03-201004-001734_bem_798_elicit_41.wav	shikalabafwako ukulwisha abalwani babo
/home/skscla001/experiments/hf/speech/data/BembaSpeech/bem/audio/03-200916-033028_bem_798_elicit_24.wav	katuibikeko ku ncito nako batupelako akanono tufwile ukukabomfya bwino bwino tacilingile cila bushiku ukubalombalomba
/home/skscla001/experiments/hf/speech/data/BembaSpeech/bem/audio/03-200925-061220_bem_798_elicit_6.wav	iyo ni ng'wena talukeniko kuli yena
/home/skscla001/experiments/hf/speech/data/BembaSpeech/bem/audio/03-200916-141341_bem_798_elicit_22.wav	ubukulu bwankoko masako
/home/skscla001/experiments/hf/speech/data/BembaSpeech/bem/audio/03-201001-105646_bem_798_elicit_37.wav	uletemwa umubiyo nga wemwine
/home/skscla001/experiments/hf/speech/data/BembaSpeech/bem/audio/07-200916-164857_bem_c20_elicit_19.wav	kabili nga wafika pesano pakutoota uyelaalafye pacishala epo uyetootela
/home/skscla001/experiments/hf/speech/data/BembaSpeech/bem/audio/03-200915-234914_bem_798_elicit_20.wav	nganasoma ifyo bambi nabo balemba bakubalumba ndaipusha nga cakuti ifilembo fyabo ngafifuma mu mutima wabo ukwabula amapange yambi yambi
/home/skscla001/experiments/hf/speech/data/BembaSpeech/bem/audio/03-200921-171929_bem_798_elicit_11.wav	ngacakuti iwe nangu umo uwo waishiba asangwa mubusanso landa naba kapokola nangu ubatumine pa zero zero zero
/home/skscla001/experiments/hf/speech/data/BembaSpeech/bem/audio/03-201004-122608_bem_798_elicit_21.wav	ku mpili uko nomba ninshi e pakuilanga ukuti cinccine kwena tuli baume tatuli bakusuula nakalya
/home/skscla001/experiments/hf/speech/data/BembaSpeech/bem/audio/03-200916-040939_bem_798_elicit_10.wav	muli fyonse kulaba ukutusambilisha bumufuma cumi
/home/skscla001/experiments/hf/speech/data/BembaSpeech/bem/audio/04-201009-110829_bem_40e_elicit_15.wav	kabili ku mulu gabriel taba na mubili iyoo
/home/skscla001/experiments/hf/speech/data/BembaSpeech/bem/audio/03-201002-063230_bem_798_elicit_0.wav	nga batila mwi ofeshi mwakaba nga mwitanuna ninshi balosha mwi
/home/skscla001/experiments/hf/speech/data/BembaSpeech/bem/audio/03-200923-215451_bem_798_elicit_0.wav	fulwe aleendafye panono panono
/home/skscla001/experiments/hf/speech/data/BembaSpeech/bem/audio/03-200925-070127_bem_798_elicit_4.wav	uyu musango kuti wakupokolola kukupusana na bantu
/home/skscla001/experiments/hf/speech/data/BembaSpeech/bem/audio/04-200916-223805_bem_346_elicit_23.wav	mwila angala ukulashinguluka ba geledi one
/home/skscla001/experiments/hf/speech/data/BembaSpeech/bem/audio/03-200923-215451_bem_798_elicit_31.wav	cila bushiku aba pelishiti baletantamika abashilika babo pa lupili no kulatinya abena isreali lubali lumbi
/home/skscla001/experiments/hf/speech/data/BembaSpeech/bem/audio/07-200916-164857_bem_c20_elicit_36.wav	imfumu apo ili yati yumfwe aiti mwe bantu iteeni uyo mulumendo ali panse ese kuno
/home/skscla001/experiments/hf/speech/data/BembaSpeech/bem/audio/03-201006-003654_bem_798_elicit_13.wav	akasuba kasuka kawa balafwaya na pakuti basendame
/home/skscla001/experiments/hf/speech/data/BembaSpeech/bem/audio/04-201008-155438_bem_40e_elicit_14.wav	basuka bafuma ku nama baya ku bantu umo ati mayo abantu ifyo banyantawilile fwaka mu ciputu
/home/skscla001/experiments/hf/speech/data/BembaSpeech/bem/audio/07-200916-162122_bem_c20_elicit_39.wav	ubushiku bumo lumbwe atuma umukashi ati kangashimineko ifumo kuli batata nsende kukulunga
/home/skscla001/experiments/hf/speech/data/BembaSpeech/bem/audio/04-201005-205341_bem_40e_elicit_3.wav	nao wine bali ifi fine
/home/skscla001/experiments/hf/speech/data/BembaSpeech/bem/audio/03-201007-002328_bem_798_elicit_8.wav	mona ulya bali na wongo ni kapokola
/home/skscla001/experiments/hf/speech/data/BembaSpeech/bem/audio/03-200921-114142_bem_798_elicit_28.wav	alebomba mumibombele iyabula ukulondoloka
/home/skscla001/experiments/hf/speech/data/BembaSpeech/bem/audio/03-200925-043821_bem_798_elicit_41.wav	ba munyina ba kasonde ilyo tamulaisa mu kasama pakubala mwaikele ku chozi pa myaka twenty six
/home/skscla001/experiments/hf/speech/data/BembaSpeech/bem/audio/03-201006-011410_bem_798_elicit_9.wav	acili alepapa umushi ubukulu napunamina mu muulu aumfwafye uko umuntu umo alemuposha
/home/skscla001/experiments/hf/speech/data/BembaSpeech/bem/audio/03-200916-142856_bem_798_elicit_22.wav	uwakalema takaleka
/home/skscla001/experiments/hf/speech/data/BembaSpeech/bem/audio/03-200925-010537_bem_798_elicit_22.wav	ilyo tulelanda pa bunte bwe pusukilo mu cilonganino mu citente atemwa mu cifulo icili conse
/home/skscla001/experiments/hf/speech/data/BembaSpeech/bem/audio/04-201008-160002_bem_40e_elicit_16.wav	nakulubantu ulya lilya bwaca umubiye bali nankwe aya awe umo aleendauka atulila ku mushi umbi nako kwine balitumine amashiwi yakuti nakasofu naluba
/home/skscla001/experiments/hf/speech/data/BembaSpeech/bem/audio/03-200921-154823_bem_798_elicit_43.wav	tumeni inkalata yapa intaneti pa helpmyblueskyorgau
/home/skscla001/experiments/hf/speech/data/BembaSpeech/bem/audio/03-200923-230549_bem_798_elicit_24.wav	afwilisha intungulushi sha mu cilonganino pamo na mu mushi wikala
/home/skscla001/experiments/hf/speech/data/BembaSpeech/bem/audio/03-200916-040939_bem_798_elicit_42.wav	abantu abengi napa bana besu bamo bamo balilaile abenamwabo ifintu ifingi panshita balefwaya ukuti babasale
/home/skscla001/experiments/hf/speech/data/BembaSpeech/bem/audio/03-201004-103454_bem_798_elicit_10.wav	nga pamoncka cimo icili nge mfwa pakati apa ninshi bashimapepo baishiba ukuti nakabili imipashi yesu ilewaya ukulya ngangu umwaka taulati upwe ukufika pa nshikunkulu
/home/skscla001/experiments/hf/speech/data/BembaSpeech/bem/audio/03-201006-015824_bem_798_elicit_6.wav	basangafye ni lingi eka uwali kuli anastasia
/home/skscla001/experiments/hf/speech/data/BembaSpeech/bem/audio/03-201007-015856_bem_798_elicit_3.wav	kabili balikekete no kuu bakakacushe
/home/skscla001/experiments/hf/speech/data/BembaSpeech/bem/audio/03-200923-215451_bem_798_elicit_37.wav	imfumu shauli tayasangile nelyo umo pa bantu bwaiko uwingeminina mukulwisha no kucimfya cilya cipondo pantu bonse bali no mwenso
/home/skscla001/experiments/hf/speech/data/BembaSpeech/bem/audio/03-200925-050356_bem_798_elicit_30.wav	mukwai tatwalebomfya ubunkolanya nangu ukubila kwa palwalala
/home/skscla001/experiments/hf/speech/data/BembaSpeech/bem/audio/03-200925-043821_bem_798_elicit_18.wav	mu nineteen ninety three natendeke ukubombela lesa nga full time worker
/home/skscla001/experiments/hf/speech/data/BembaSpeech/bem/audio/03-200916-120506_bem_798_elicit_30.wav	na mu cibemba mwine umulungu wakwata inshiku cinelubali tafyapusana iyo
/home/skscla001/experiments/hf/speech/data/BembaSpeech/bem/audio/04-200917-202808_bem_346_elicit_12.wav	cinshi ulelilila
/home/skscla001/experiments/hf/speech/data/BembaSpeech/bem/audio/03-201002-093346_bem_798_elicit_8.wav	pakutila bengalanga nacisungu ubukankala bwambuto
/home/skscla001/experiments/hf/speech/data/BembaSpeech/bem/audio/03-201006-005222_bem_798_elicit_8.wav	nomba umwakuti aciloshe temo e mwabulile
/home/skscla001/experiments/hf/speech/data/BembaSpeech/bem/audio/03-201004-122608_bem_798_elicit_9.wav	ku moolu balwalako ne ndyato
/home/skscla001/experiments/hf/speech/data/BembaSpeech/bem/audio/04-201005-212919_bem_40e_elicit_3.wav	balelya utumpolyo ne nsasa ne mishila ya miti imoimo
/home/skscla001/experiments/hf/speech/data/BembaSpeech/bem/audio/03-201007-015856_bem_798_elicit_7.wav	umwana wandi umo aila ku kufwaye mfuti shakuli ese acimfishemo abalwani bamuteka ku munga we fwafwa
/home/skscla001/experiments/hf/speech/data/BembaSpeech/bem/audio/07-200916-164857_bem_c20_elicit_14.wav	cisuma mune wabomba
/home/skscla001/experiments/hf/speech/data/BembaSpeech/bem/audio/03-200925-043821_bem_798_elicit_26.wav	magazine musuma akabila ifikope nefilangililo ifisuma
/home/skscla001/experiments/hf/speech/data/BembaSpeech/bem/audio/04-200916-232135_bem_346_elicit_14.wav	ululimi lusuminishiwa mu geledi cinyanja
/home/skscla001/experiments/hf/speech/data/BembaSpeech/bem/audio/04-200914-215547_bem_346_elicit_49.wav	nomba mulishinonshiku nangu lintu ulendela muli basi
/home/skscla001/experiments/hf/speech/data/BembaSpeech/bem/audio/04-200914-220511_bem_346_elicit_15.wav	finshi efyo mwalecita ku chalimbana
/home/skscla001/experiments/hf/speech/data/BembaSpeech/bem/audio/03-200924-194133_bem_798_elicit_44.wav	ecalenga ifwe fwe bantu bakwe tulingile ukusambilila inshila uyu lesa apusushishamo
/home/skscla001/experiments/hf/speech/data/BembaSpeech/bem/audio/03-201006-015824_bem_798_elicit_18.wav	kena kaleti ni kutulo kanshi cinecine
/home/skscla001/experiments/hf/speech/data/BembaSpeech/bem/audio/03-200916-010158_bem_798_elicit_47.wav	ngaifwe cinshi tatubwelela uko twafuma
/home/skscla001/experiments/hf/speech/data/BembaSpeech/bem/audio/03-201001-105646_bem_798_elicit_15.wav	nati nokuti awe ciine ilyo bali abalumendo nenkoko shalepelakwali  akantu nakabiye
/home/skscla001/experiments/hf/speech/data/BembaSpeech/bem/audio/03-200916-033028_bem_798_elicit_13.wav	apo cili fi tekulaba ukulomba lesa ubwafwilisho bwakwe ulo tulenwa umuti wakutubwesesha amaka mu mubili
/home/skscla001/experiments/hf/speech/data/BembaSpeech/bem/audio/03-200924-200908_bem_798_elicit_3.wav	bushe abashilika ba mu mulalo wakwa shauli nga balicimfishe
/home/skscla001/experiments/hf/speech/data/BembaSpeech/bem/audio/03-201007-013831_bem_798_elicit_6.wav	afwika na maria ati ndefwayo ku kuupa
/home/skscla001/experiments/hf/speech/data/BembaSpeech/bem/audio/07-200916-171635_bem_c20_elicit_22.wav	mu nanda mwafita na fititi
